{
  "schemaVersion": 1,
  "generatedAt": "2026-05-04T20:37:20.574Z",
  "business": {
    "slug": "napoletana-nostra",
    "name": "Napoletana Nostra",
    "description": "",
    "enabledFields": [
      "price",
      "brand",
      "currency",
      "tags",
      "sku"
    ]
  },
  "categories": [
    "Pije"
  ],
  "products": [
    {
      "name": "Coca Cola",
      "slug": "coca-cola",
      "businessSlug": "napoletana-nostra",
      "businessName": "Napoletana Nostra",
      "category": "Pije",
      "description": "fresh",
      "details": {},
      "images": [
        "https://kresha325.github.io/Product-System/images/napoletana-nostra/coca-cola/1.webp"
      ],
      "updatedAt": "2026-05-04T09:57:37.983Z"
    }
  ]
}